commit_id,line,line_level_label,count,line_score,row
39e3bff18ab9a83ef8b2dd531604f3e424b98b65,from oslo.config import cfg,1,4,1.0,1
39e3bff18ab9a83ef8b2dd531604f3e424b98b65,from neutron.conf.agent import common as agent_config,0,4,1.0,2
39e3bff18ab9a83ef8b2dd531604f3e424b98b65,from neutron.agent.common import config as a_cfg,1,4,1.0,3
39e3bff18ab9a83ef8b2dd531604f3e424b98b65,from oslo_config import cfg,0,3,0.75,4
39e3bff18ab9a83ef8b2dd531604f3e424b98b65,agent_config.register_root_helper(cfg.CONF),0,0,0.0,5
39e3bff18ab9a83ef8b2dd531604f3e424b98b65,"cfg.CONF.register_opts(a_cfg.ROOT_HELPER_OPTS, 'AGENT')",1,0,0.0,6
